[
  {
    "schema_version": 2,
    "delivery_id": "delivery_demo_complete",
    "revision": 1,
    "previous_revision": null,
    "narration_id": "narration_demo_complete",
    "conversation_id": "chat_demo",
    "source_event_id": "event_task_completed",
    "canonical_message_id": "message_narration_demo_complete",
    "status": "prepared",
    "canonical_message_status": "pending",
    "canonical_commit_receipt_id": null,
    "speech_status": "not_requested",
    "session_generation": null,
    "speech_request_id": null,
    "provider_item_id": null,
    "playback_ms": 0,
    "final_text_sha256": null,
    "watermark_sequence": null,
    "created_at": "2026-08-02T12:30:00Z",
    "updated_at": "2026-08-02T12:30:00Z",
    "terminal_at": null,
    "foreground_route_id": "foreground_route_voice_demo_02",
    "foreground_route_epoch": 2,
    "foreground_owner_claim_id": "foreground_claim_voice_demo_02",
    "previous_status": null
  },
  {
    "schema_version": 2,
    "delivery_id": "delivery_demo_complete",
    "revision": 2,
    "previous_revision": 1,
    "narration_id": "narration_demo_complete",
    "conversation_id": "chat_demo",
    "source_event_id": "event_task_completed",
    "canonical_message_id": "message_narration_demo_complete",
    "status": "speech_requested",
    "canonical_message_status": "pending",
    "canonical_commit_receipt_id": null,
    "speech_status": "requested",
    "session_generation": 3,
    "speech_request_id": "speech_request_demo_complete",
    "provider_item_id": null,
    "playback_ms": 0,
    "final_text_sha256": null,
    "watermark_sequence": null,
    "created_at": "2026-08-02T12:30:00Z",
    "updated_at": "2026-08-02T12:30:01Z",
    "terminal_at": null,
    "foreground_route_id": "foreground_route_voice_demo_02",
    "foreground_route_epoch": 2,
    "foreground_owner_claim_id": "foreground_claim_voice_demo_02",
    "previous_status": "prepared"
  },
  {
    "schema_version": 2,
    "delivery_id": "delivery_demo_complete",
    "revision": 3,
    "previous_revision": 2,
    "narration_id": "narration_demo_complete",
    "conversation_id": "chat_demo",
    "source_event_id": "event_task_completed",
    "canonical_message_id": "message_narration_demo_complete",
    "status": "speaking",
    "canonical_message_status": "pending",
    "canonical_commit_receipt_id": null,
    "speech_status": "playing",
    "session_generation": 3,
    "speech_request_id": "speech_request_demo_complete",
    "provider_item_id": "provider_item_demo_complete",
    "playback_ms": 1000,
    "final_text_sha256": null,
    "watermark_sequence": null,
    "created_at": "2026-08-02T12:30:00Z",
    "updated_at": "2026-08-02T12:30:02Z",
    "terminal_at": null,
    "foreground_route_id": "foreground_route_voice_demo_02",
    "foreground_route_epoch": 2,
    "foreground_owner_claim_id": "foreground_claim_voice_demo_02",
    "previous_status": "speech_requested"
  },
  {
    "schema_version": 2,
    "delivery_id": "delivery_demo_complete",
    "revision": 4,
    "previous_revision": 3,
    "narration_id": "narration_demo_complete",
    "conversation_id": "chat_demo",
    "source_event_id": "event_task_completed",
    "canonical_message_id": "message_narration_demo_complete",
    "status": "completed",
    "canonical_message_status": "committed",
    "canonical_commit_receipt_id": "message_commit_receipt_narration_demo_complete",
    "speech_status": "completed",
    "session_generation": 3,
    "speech_request_id": "speech_request_demo_complete",
    "provider_item_id": "provider_item_demo_complete",
    "playback_ms": 4100,
    "final_text_sha256": "54f7c48905e5bf0d21303127f1b2dfc699eddb86e1312501a4f6f37e8ebc9201",
    "watermark_sequence": 13,
    "created_at": "2026-08-02T12:30:00Z",
    "updated_at": "2026-08-02T12:30:05Z",
    "terminal_at": "2026-08-02T12:30:05Z",
    "foreground_route_id": "foreground_route_voice_demo_02",
    "foreground_route_epoch": 2,
    "foreground_owner_claim_id": "foreground_claim_voice_demo_02",
    "previous_status": "speaking"
  }
]
